"id_local","nom_lieu","ad_lieu","com_lieu","insee","type","date_maj","ouvert","source","Xlong","Ylat","nbre_pl","nbre_pmr","duree","horaires","proprio","lumiere","comm"
"C-001","Parking de la mairie de Brétigny","52 Rue de Picardie ","Brétigny ","60105","Parking","2024-01-09","true","","3.1112","49.567374","2","","","","","true","Panneau covoiturage Oise mobilité"
"C-002","Parking de la mairie de Crisolles ","1 place de la mairie ","Crisolles","60181","Parking","2024-01-09","true","","3.013838","49.622147","2","","","","","true","Panneau covoiturage Oise mobilité"
"C-003","Parking de la mairie de Cuts ","45 Place du Maréchal Leclerc","Cuts ","60189","Parking","2024-01-09","true","","3.101541","49.531446","2","","","","","false","Panneau covoiturage Oise mobilité"
"C-004","Parking place de Magny","Place de Magny ","Guiscard ","60291","Parking","2024-01-09","true","","3.05012","49.655242","3","","","","","true","Panneaux covoiturage Oise mobilité"
"C-005","Parking centre commercial Auchan","ZAC du Mont Renaud","Noyon","60471","Parking","2024-01-09","true","","2.980400","49.570700","3","","","","","false","Panneau covoiturage Oise Mobilité"
"C-006","Parking de la gare de Noyon","Avenue de la Gare ","Noyon","60471","Parking","2024-01-09","true","","3.007177","49.577782","5","","","","","true","Panneaux covoiturage Oise Mobilité"
